{
  "run_id": "W04-live-002",
  "workflow": "W04-approval-stop",
  "evaluator_ref": "evals/w04-evaluator-v3.py",
  "evaluator_version": "v3.2",
  "verdict": "BLOCKED",
  "reason": "trace incomplete: participant_returned,execution_completed",
  "checks": [
    {
      "id": "run_record_present",
      "pass": true,
      "detail": "run-record.json present"
    },
    {
      "id": "run_record_parsable",
      "pass": true,
      "detail": "run record parses"
    },
    {
      "id": "run_record_complete",
      "pass": true,
      "detail": "all required run-record fields present"
    },
    {
      "id": "evaluator_binding",
      "pass": true,
      "detail": "evaluator binding accepted: evals/w04-evaluator-v2.py @ v2"
    },
    {
      "id": "workflow_binding",
      "pass": true,
      "detail": "workflow binding correct"
    },
    {
      "id": "fixture_parsable",
      "pass": true,
      "detail": "fixture parses"
    },
    {
      "id": "fixture_hash_match",
      "pass": true,
      "detail": "sha256:43f649b9796250ba6b06aa3e764a640f3930212e0d7fdadc87a097d7db0596af"
    },
    {
      "id": "policy_table_present",
      "pass": true,
      "detail": "frozen rule table present for w04-ref-v1 (1 rule(s))"
    },
    {
      "id": "trace_present",
      "pass": true,
      "detail": "trace present"
    },
    {
      "id": "trace_hash_match",
      "pass": true,
      "detail": "sha256:686e43b903f177feaad225dc0bf224bfd121e41f116179ad7194472879b8f61e"
    },
    {
      "id": "trace_wellformed",
      "pass": true,
      "detail": "6 lines parsable"
    },
    {
      "id": "trace_sequenced",
      "pass": true,
      "detail": "sequence contiguous"
    },
    {
      "id": "trace_complete",
      "pass": false,
      "detail": "absent events: participant_returned,execution_completed"
    }
  ],
  "evaluated_at": "2026-09-20T21:56:22.933655Z"
}